文档ID,簇编号,原文片段（分词行）
549,1,财经 长信 基金 理性 视野 把握 投资 时机 全球 经济 放缓 资产 全线 贬值 严重 打击 投资者 信心 关注 投资 领域 证券市场 牵动 亿万 民众 神经...
550,1,财经 华夏 基金 修改 旗下 部分 开放式 基金 合同条款 全景网 日讯 华夏 基金 公告 公司 决定 旗下 部分 开放式 基金 基金 合同 修改 修改 内容 ...
551,3,体育 德隆 球队 施压 要求 补强 篮网 爵士 吸引力 北京 季后赛 停摆 很多 球员 考虑 去处 本赛季 转会 篮网 德隆 一员 接受 采访 考虑 打球 篮网...
552,4,游戏 千尺 宝典 流量 大片 手机 账单 冥想 电影 大片 接二连三 手机 频繁 下载 流量 飘走 商家 整天 智能手机 取代 电脑 现实 残酷 G 上马 资费...
553,4,游戏 天问 online 财神 烧香 体验 一回 民俗文化 财神爷 民俗 财神 日子 好多 财神庙 第一 柱香 敬香 财神 方式 祈福 祈求 好运 祝福 财运 ...
554,5,娱乐 主演 澳洲 乱世 确定 贺岁 本报讯 杨林 发行 获悉 第一波 分账 大片 出炉 上映 马达加斯加 基德曼 主演 澳洲 乱世 Austrila 登陆 杰森...
555,5,娱乐 组图 权相宇 复出 煽情 告白 新片 恋上 李宝英 问到 出生 孩子 权相宇 孩子 胎名 Lucky 孩子 出生 幸运 名字 权卢克 确定 名字 权相宇 ...
556,5,娱乐 时尚 点评 白色 多元 拼接 时尚 新潮流 娱乐 北京 美国 奥斯卡金像奖 颁奖典礼 洛杉矶 柯达 剧院 举行 北京 众星 盛装 走上 红地毯 红毯 PK...
557,2,体育 小牛 离谱 命中率 吓傻 湖人 热火 绿衫 小牛 客场 赢球 不能 晋级 低着头 走回 休息室 湖人 系列赛 噩梦 湖人 承认 小牛 太强大 洛城 专家 ...
558,5,娱乐 龙珠 神龙 现身 剧照 火力 娱乐 好莱坞 真人版 电影 龙珠 进化 Dragonball Evolution 日本 电视节目 放出 镜头 传开 灵通人士...
559,4,游戏 力作 火爆 上线 PC 单机游戏 呈现 游戏 精彩 亮点 游戏 历时 八个 完美 移植 手机 游戏 讲述 美丽 大陆 完美 作品 大陆 依靠 水晶 能量 ...
560,4,游戏 灵兽 世界 OL 任务 活动 灵兽 世界 任务 活动 全面 上线 想要 大量 经验 想要 装备 材料 解封 奖励 研究 活动 内容 小时 奖励 任务 完成...
561,3,体育 绿军 客队 更衣室 外险 斗殴 不开 北京 热火 绿军 赛场 气氛 火爆 延续 比赛 两个 随队 争抢 位置 打架 比赛 小时 主帅 惯例 客队 更衣室 ...
562,3,体育 主帅 解释 第四节 犯规 梅奥 豪言 六场 解决 战斗 北京 mysanantonio NBA 季后赛 首轮 孟菲斯 客场 不敌 圣安东尼奥 马刺 总比分...
563,4,游戏 d 网游 赤壁 OL 阳春 风景 独好 阳春 掩饰 不住 春色 一场 大雪 阻挡 不了 昂然 春意 呼朋引 春色 美景 不了 d 赤壁 OL 景色 唯美 ...
564,5,娱乐 蝙蝠侠 亲人 认罪 可免 起诉 娱乐 蝙蝠侠 贝尔 酒店 母亲 姐姐 案件 控方 律师 警方 建议 作出 警告 条件 承认 控罪 警方 起诉 袭击 被控 ...
565,3,体育 马刺 获胜 功臣 宣布 参战 欧锦赛 帕克 渴望 搭档 加时赛 比赛 帮助 马刺 获胜 功臣 托尼 帕克 确定 参加 欧锦赛 法国 发动机 开赴 立陶宛 ...
566,0,科技 高清 防抖 卡片机 索尼 T900 促销 丰富 配件 中关村 数码相机 行情 索尼 T900 继承 T 传统 外形 优势 一部 高像素 传感器 HDTV ...
567,5,娱乐 沃斯堡 影评人 协会 贫民 富翁 胜出 娱乐 北京 执着 预测 奥斯卡 奖项 提名 闻名 沃斯堡 影评人 协会 Dallas Fort Worth Fil...
568,5,娱乐 组图 亮相 地球 毁灭 密码 纽约 首映 娱乐 北京 美国 出演 灾难片 地球 毁灭 密码 纽约 举行 首映礼 两位 主演 和鲁思 两位 小演员 Chan...
569,4,游戏 D 赛车手 巨献 狂飙 D 完美版 D 赛车 手机游戏 巨献 狂飙 D 完美版 风格 独特 D 赛车 游戏 游戏 设置 车型 玩家 选择 设置 场景 赛道...
570,0,科技 光学 变焦镜头 三星 WB1000 机型 秉承 三星 蓝调 复古 外观 仪表盘 看起来 全金属 机身 配以 光滑 黑色 涂层 看起来 十分 大气 机身 手...
571,5,娱乐 澳大利亚 纽约 化身 时尚 教母 娱乐 美国 澳大利亚 Australia 纽约 工作室 看片会 基德曼 双双 出席 影片 内容 采访 发言 试映 结束 ...
572,3,体育 兰胖 暴走 决战 一场 北京 主场 击败 雷霆 系列赛 拖入 全场 篮板 封盖 荣膺 展现 出来 统治力 马刺 第六场 一节 华丽 演出 视作 季后赛 封...
573,4,游戏 好玩 玄幻 帝王 动作游戏 轩辕 知名 手机游戏 开发商 北京 掌中 飞天 玄幻类 帝王 传奇 动作游戏 轩辕 隆重 登陆 手机游戏 网站 掌中 飞天 R...
574,5,娱乐 茱莉 金球奖 受访 中新网 金球奖 颁奖典礼 落幕 布拉德 皮特 Brad Pitt 安吉 茱莉 Ange 听歌 lina Jolie 星光 大道 采访 ...
575,1,财经 诺安 基金 信托 利益输送 理财 周报 仇晓慧 私募 人士 爆料 诺安 基金 深国投 合作 结构化 信托 产品 存在 利益输送 嫌疑 深国投 网站 看到 ...
576,4,游戏 豪华 大作 启示录 烙印 系统 详解 启示录 豪华 制作 角色扮演 游戏 升级 引擎 游戏 画面 特效 战斗 设置 辅助 系统 游戏 提高 层次 全屏 特...
577,1,财经 基金 招聘 渠道 投研 人才 证券时报 程俊琳 金鹰 基金 公司 发布 招聘 渠道 投研 部门 力量 扩充 方向 基金 公司 加速 人才 储备 继续 增加...
578,4,游戏 d 赤壁 OL 内容 亲爱 亲们 大家 例行 服务器 d 赤壁 OL 支持 理解 内容 1. 修正 结义 军团 升级 方式 只能 升级 军团 2. 降低 ...
579,4,游戏 神兆 OL 新区 一剑 凌云 富有 神秘 色彩 横版 网游 神兆 OL 经历 半个 版本 优化 强势 开放 一剑 凌云 新区 火热 程度 不亚于 盛夏 海...
580,5,娱乐 档案 日程 导演 制作 计划 娱乐 北京 北美 媒体报道 神秘 美剧 迷失 lost 制作 电影 碟中谍 Mission Impossible III 导...
581,4,游戏 时空 OL 公测 亮点 揭秘 时空 团队 异地 合作 副本 轮回 交叉 时空 任务 核心 玩法 穿越 网游 时空 OL 删档 内测 受到 玩家 火热 追捧...
582,4,游戏 游记 网游 理念 用户 体验 区别 娱乐 方式 进化 网络 技术 发展 网络游戏 新鲜 玩意 绝大多数 生活 一部分 听说 网游 网游 白领 人群 热点 ...
583,0,科技 时尚 卡片机 尼康 S220 套装 尼康 S220 延续 S 纤巧 超薄 机身 设计 铝合金 材质 打造 表面 质地 细腻 不易 沾染 指纹 S220 紫...
584,4,游戏 封神 ol 大手笔 送礼 丰满 中国 富有 特色 传统节日 标志 一年 结束 一年 人们 告别 寒冷 迎接 一零年 新春 即将来临 回馈 玩家 封神 ol...
585,3,体育 深锐 观察 季后赛 平民 球队 难逃 无核 悲剧 面对 球星 当家的 季后赛 对手 平民 球队 步行者 掘金 金四辉 平民 秘诀 面对 尴尬 局面 几位 ...
586,0,科技 千万 像素 入门 DC 三星 ES15 山东 IT 三星 ES15 商家 济南 北星 数码 G 三星 原装 MAH 充电 套装 液晶屏 保护膜 三脚架 售...
587,4,游戏 手机 网游 天问 OL 城市 建议 两周 听说 天问 推出 城市 战争 网游 混迹 多年 玩家 城战 相信 大家 不会 陌生 很多 游戏 内容 内容 刺激...
588,0,科技 完美 征服 索泰 P 高清 HTPC 到货 津门 促销 类型 主板 促销 起始 促销 内容 高清 播放 功能 变得 重要 原生 HDMI 支持 P 高清 ...
589,0,科技 尼克尔 变焦镜头 尼康 S230 套装 作者 宋心杰 尼康 COOLPIX S230 配备 2.3 英寸 有效 像素 CCD 影像 感应器 记录 像素 照...
590,0,科技 拍照 摄影 轻松 上传 JVC MS100AC 套装 促销 中关村 数码相机 行情 JVC GZ MS100 像素 配备 光学 变焦镜头 SDHC SD ...
591,4,游戏 绿色 健康 女儿国 OL VIP 掉落 绿色 健康 女儿国 游戏 体验 升级 革命性 变革 飓风 席卷 女儿国 大陆 火爆 三月 女儿国 开启 征程 天宫...
592,0,科技 MOS 感光 元件 DV 松下 HS200GK 促销 观点 松下 HS200 GB 容量 存储空间 满足 大部分 需求 MOS 感光 元件 设计 保证 色...
593,1,财经 ETF 信息 披露 出错 套利 资金 王艳伟 ETF 开盘 即跌 2.32 标的 指数 0.22 全天 成交额 不到 万元 状况 交易 指数 基金 修正 ...
594,0,科技 专业级 单反相机 佳能 D 套装 降至 北京 行情 mm 变焦 镜头 很多 单反相机 资深 玩家 出色 性价比 变焦 覆盖 能力 众多 初学 摄影 爱好者...
595,3,体育 热火 最帅 先生 牛皮 大圆 不了 连中 没中 三分 跳起 英俊 面庞 表情 无比 坚毅 唏嘘 胡渣 板寸 发型 更添 男人 风采 跳起 便是 坚定 无视...
596,4,游戏 网游 豪侠 宠物 技能 登场 Q 手机 网游 豪侠 精彩 登陆 游戏 价值 元宝 道具 奖励 豪侠 宠物 系统 开放 玩家 精心 培育 爱宠 级别 爱宠 ...
597,5,娱乐 奥斯卡 茱莉 VS 红毯 暗战 奥斯卡 颁奖典礼 瞩目 焦点 安吉丽娜 茱莉 红毯 暗战 美国 媒体报道 男友 梅尔 坦承 一起 出席 颁奖 布莱德 安吉...
598,5,娱乐 萨尔玛 海耶克 加盟 桑德勒 新片 娱乐 北京 媒体报道 萨尔玛 海耶克 Salma Hayek 玛雅 鲁道夫 Maya Rudolph 柯林 Colin...
599,1,财经 泰信 基金 万元 认购 旗下 新品 证券时报 本报讯 获悉 泰信 基金 公司 动用 万元 资金 认购 旗下 发行 产品 泰信 精选 股票 型基金 据悉 泰...
600,0,科技 更酷 iPod nano iPod 大名 时尚 代名词 设计 实在 时尚 诱人 苹果 隆重 发布 iPod nano4 纤薄 设计 乔布斯 提醒 大家 千...
601,5,娱乐 美人图 第二部 预告片 曝光 金敏善 娱乐 韩国 电影 美人图 第二部 预告片 影片 主演 金敏善 预告片 上阵 抓住 观众 目光 美人图 讲述 朝鲜 时...
602,4,游戏 手机游戏 剑侠 媚影 完美 测评 评测 游戏 剑侠 媚影 国产 游戏 格式 JAD JAR 游戏 类别 角色扮演 回合 游戏 K 游戏 语言 中文 提供商...
603,1,财经 股票 基金 全线 上扬 四成 基金 全景网 日讯 开放式 基金 多数 上涨 股票 型基金 全盘 四成 基金 债券 型基金 超过 八成 上扬 上证综指 累计...
604,0,科技 佳能 D 套机 摄影包 中关村 数码相机 行情 佳能 D 像素 成像 能力 数码 单反相机 较高 性价比 市场 明星 产品 D 大量 上市 老将 售价 降...
605,4,游戏 文明 II 新春 大礼包 获奖 名单 文明 II 新春 礼包 疯狂 活动 第二轮 幸运 玩家 新鲜出炉 截止 文明 II 新春 礼包 疯狂 活动 圆满结束...
606,1,财经 基金 狂飙 中邮 13.04 埋伏 地产 有色 理财 周报 代星 股票 基金 排名 愚人节 显得 富有 戏剧性 投资者 沮丧 基金 漂亮 反攻 业绩 垫底...
607,3,体育 雷霆 裁判 第二轮 15.4 生死 改判 or 掘金 手握 优势 雷霆 看上去 扳回 一场 雷霆 凯文 杜兰特 掘金 倒在 KD 掘金 理由 不服 裁判 ...
608,4,游戏 网游 武林 OL 轻松 打造 星级 极品 掌上明珠 经典 武侠 题材 手机 网游 武林 OL 世界 众多 武侠 世界 玩家 属性 超强 装备 武装 全身 ...
609,3,体育 绿军 将帅 直言 波什 未知 因素 KG 我会 重点 照顾 北京 美国 网站 WEEI 对手 詹姆斯 德维恩 韦德 熟悉 接受 采访 热火队 巨头 一位 ...
610,4,游戏 简乐 新作 启示录 制作 访谈 简乐 开篇 豪华 制作 欧风 巨作 启示录 接连 放出 截图 口水 三千尺 画面 场景 精致 细腻 富有 质感 颜色 搭配...
611,1,财经 基金业 亏损 1.5 万亿元 李良 上海 A股 市场 大跌 基金 亏损累累 相投 基金 年报 得出 统计数据 显示 基金业 亏损 1.5 万亿元 型基金 ...
612,3,体育 孩子 变得 成熟 德克 总冠军 戒指 北京 本赛季 季后赛 小牛队 老板 马克 沉寂 小牛 横扫 湖人 少见 没见 发表 高论 颇为 罕见 接受 采访 透...
613,5,娱乐 和西恩 有望 出演 附图 娱乐 北京 北美 媒体报道 和西恩 有望 出演 据说 法拉利 兄弟 Farrelly Brothers 一部 新片 物色 演员 ...
614,0,科技 全能 长焦机 三星 WB550 GB 中关村 数码相机 行情 三星 WB550 一枚 2.3 英寸 有效 像素 CCD 图像 传感器 拍摄 最大 分辨率 ...
615,5,娱乐 三个 家伙 观影 数破 投资 全数 收回 娱乐 金知云 导演 新片 家伙 家伙 上映 突破 观影 盈利 分界线 家伙 家伙 登陆 韩国 银幕 耗资 高达 ...
616,1,财经 基金 收益 首尾 相差 早报 肖莉 波动 A股 市场 基金 季度 收益 最好 基金 收益 最差 基金 差距 超过 有涨 有跌 投资 业绩 基金 经理 压力...
617,5,娱乐 盘点 好莱坞 明星 目标 迪亚兹 新年伊始 制定 一年 目标 关注 寻找 改掉 坏毛病 改变 生活习惯 美国 演艺 明星 目标 告别 烟圈 好莱坞 女星 ...
618,5,娱乐 宫廷 大戏 公爵夫人 上映 层层 发髻 英国 女星 化身 公爵夫人 描写 世纪 宫廷 贵族 古装片 公爵夫人 亮相 银幕 华丽 装扮 养眼 头疼 事情 特...
619,3,体育 直击 新秀 三分 还魂 英雄 康利险 历史 罪人 雷霆 依靠 找到 手感 核心 凯文 杜兰特 裁判 争议 出界 判罚 失误 拿球 发动 反击 康利 出手 ...
620,0,科技 三星 活动 第二期 中奖 确定 手持 电视 三星 活动 第一期 中奖 确定 幸运 三星 CMMB 移动 电视 YP CM3 一台 撰写 测评 机会 YP ...
621,4,游戏 手游 九州 OL 新区 天龙八部 九州 online 资料片 风云 再起 开启 服务器 天龙八部 充满 奇幻 世界 众多 英雄豪杰 开辟 逐鹿 舞台 征战...
622,4,游戏 九州 OL 重奖 犒赏 精益求精 魅力 国产 武侠 玄幻 巨作 九州 online 资料片 风云 再起 深受 玩家 喜爱 关注 百余 玩法 创新 特色 元...
623,0,科技 单反相机 尼康 D5000 套机 D60 升级版 D5000 延续 尼康 传统 机身 设计 包括 机身 按钮 设计 手柄 标志性 红色 机身 整体 外形尺...
624,5,娱乐 放弃 演戏 秘密 筹备 电影 娱乐 出演 角斗士 反角 杰昆 Joaquin Phoenix 外界 宣布 演戏 代表 放弃 电影 事业 可靠消息 拍摄 一...
625,5,娱乐 谎言 之躯 巴黎 首映 英俊 神情 严肃 娱乐 电影 谎言 之躯 Body of Lies 巴黎 首映 主演 迪卡 Leonardo DiCaprio 帅...
626,4,游戏 神戒 Online 内测 全国 首款 wap2 .0 网游 神戒 Online 内测 充满 无限 可能性 充满 惊奇 未知 充满 无数 挑战 机会 魔幻 ...
627,0,科技 有效 像素 DC FE3010 外观 FE3010 金属 质感 外壳 设计 极具 时尚 17.8 mm 超薄 机身 g 机身 重量 轻薄 三种 颜色 不同...
628,1,财经 经济 增长 结构性 特征 北京 银华 基金 投资 策略 中国 宏观经济 企稳 恢复 预期 银华 基金 全球 经济 经历 漫长 平衡 过程 应对 全球性 国...
629,0,科技 光学 变焦镜头 尼康 P90 作者 宋心杰 尼康 P90 配备 变焦 尼克尔 镜头 覆盖范围 mm 广角 延伸 mm 焦距 结合 有效 像素 2.33 英...
630,5,娱乐 全智贤 新片 海报 曝光 武士刀 眼神 凌厉 娱乐 北京 韩国 媒体报道 韩国 女演员 全智贤 主演 电影 吸血鬼 英国 宣传 海报 首次 曝光 影片 第...
631,0,科技 单反相机 佳能 D 带票 套装 作者 李金昊 佳能 EOS D 图像 感应器 有效 像素 照片 具有 像素 高分辨率 APS C 画幅 图像 感应器 高端...
632,5,娱乐 柏林 有点 梅兰芳 有点 德国 北京 柏林 电影节 拉开帷幕 欧洲 电影节 选择 季节 举办 柏林 电影节 占据 评选 获奖 影片 冷门 全球 金融危机 ...
633,1,财经 基金 被盗 第一案 原告 胜诉 获赔 黑龙江 哈工大 高科技 风险投资 有限公司 发起 设立 黑龙江省 创业 风险投资 协作 机构 经历 基金 被盗 第一...
634,1,财经 船舶 产业 投资 基金 顺势 抄底 于祥明 船舶 产业 投资 基金 逆市 基金 管理 合伙 企业 副总经理 王坤 船舶工业 应对 金融危机 高峰论坛 上向...
635,4,游戏 仙剑 奇侠传 忆仙 完美 图文 攻略 纪念 凄美 追忆 世人 忘却 传奇 重拾 回忆 角度 感受 不同 仙剑 世界 第二章 苏州城 来到 苏州城 李逍遥 ...
636,1,财经 泰信 基金 认购 泰信 精选 吴晓婧 了解 泰信 基金 动用 万元 资金 认购 旗下 发行 泰信 精选 泰信 基金 自购 基金 显示 公司 愿意 持有人 ...
637,1,财经 讲究 组合 搭配 货币 市场 基金 债券 型基金 配备 新快报 吴谭 炒股 中产者 心痛 国际 视野 QDII 基金 金融 海啸 亏损 惨重 股票 型基金...
638,0,科技 搭配 mm 镜头 佳能 D 套机 作者 李金昊 产品 EOS D 图像 感应器 有效 像素 照片 具有 像素 高分辨率 APS C 画幅 图像 感应器 高...
639,0,科技 百万 高清 火眼金睛 平安 HD720QP 监控器 云南 IT www ynit580 com 人民 安居乐业 社会 存在 一部分 原因 存在 程度 促进...
640,5,娱乐 尸检 脑出血 娱乐 北京 媒体报道 公布 尸检 结果表明 滑雪 事故 Natasha Richardson 脑部 出血 脑出血 导致 死亡 尸体 检验 医...
641,3,体育 阿巴斯 反击 仇恨 告诉 上海 优秀 北京 CBA 比赛 打响 回到 主场 北京 金隅 迎战 上海 主力 控卫 学林 开场 不久 受伤 下场 出色 北京队...
642,0,科技 画幅 单反相机 尼康 D300S 售价 D300S 尼康 DX 格式 CMOS 影像 感应器 有效 像素 ISO 感光度 范围 噪点 条件 影像 效果 选...
643,4,游戏 虎啸 迎新 辞旧岁 双城 OL 大礼 新春 即将来临 喜迎 时刻 双城 OL 推出 活动 活动 内容 丰富 趣味 横生 奖励 丰富 惊艳 实物 大礼 ps...
644,1,财经 首只 发行 证券日报 市场 上首 友邦 华泰 货币 市场 基金 中国证监会 批准 发行 市场 一只 货币 产品 基金 众多 银行 券商 银行 券商 全国 ...
645,3,体育 咬碎 钢牙 加索 超越 全明星 哥哥 NBA 西区 季后赛 第二轮 主场 力克 雷霆 系列赛 领先 对手 中锋 马克 加索尔 上场 篮板 封盖 加索尔 拼...
646,1,财经 撤离 散户 接盘 封基牛 涨起来 李娜 发自 上海 封基 封基 年度 分红 行情 A股 跌穿 向来 抗跌 集体 遭遇 重挫 封基 埋伏 申银万国 发布 统...
647,0,科技 大容量 DV 索尼 SR47E 单机 中关村 数码相机 行情 索尼 数码 摄像机 产品 SR47E 搭载 一枚 英寸 像素 CCD 传感器 配备 光学 变...
648,5,娱乐 布拉德 皮特 热心 慈善 赞为 模范 国民 娱乐 北京 香港媒体 布拉德 皮特 现身 华盛顿 美国众议院 议长 佩洛西 会面 讨论 慈善 组织 重建 工作...
649,5,娱乐 经典 Cult 电影 恐怖 继续 经典 Cult 恐怖 翻拍 MTV 电影 公司 宣布 恐怖 拍成 时长 小时 电视 电影 万圣节 播放 恐怖 原本 一台...
650,5,娱乐 公园 编剧 癌症 享年 娱乐 洛杉矶 好莱坞 著名 编剧 代表作 公园 续集 失落 世界 科幻 畅销书 作家 奇顿 John Michael Cricht...
651,1,财经 增强 分红 派现 0.48 全景网 日讯 基金 公告 旗下 增强 债券 型基金 成立 第十四次 收益分配 实现 分配 收益 基准 基金 份额 派发 红利 ...
652,0,科技 DC 尼康 D3000 套机 尼康 特地 D3000 搭配 VR 镜头 组合 成套 销售 防抖 镜头 加入 有效 提高 尼康 D3000 弱光 范围 D3...
653,3,体育 广东 半场 狂飙 狂胜 山东 江华 关键 闪光 稳住 全队 阵脚 面对 连胜 山东队 败退 乌鲁木齐 广东 东莞 银行 下半场 攻击 狂潮 赢得 一场 大...
654,3,体育 罗斯坦 冲冲 对手 投开 北京 罗斯 神灵 附体 芝加哥 公牛 客场 大胜 亚特兰大 老鹰 总比分 领先 一场 属于 新科 常规赛 MVP 比赛 罗斯 生...
655,4,游戏 武林 OL 浓情 巨献 极品 装备 武侠 题材 手机 网游 经典 巨作 武林 OL 演义 门派 恩怨 纠葛 展现 英雄本色 侠女 断骨 柔情 精彩 活动 ...
656,1,财经 基金 公司 首次 现身 纳税 百强 安仲文 黄金 一份 综合 纳税 百强 排行榜 基金 公司 危机 强势 增长 凸现 出来 广东省 相关 部门 发布 年度...
657,1,财经 呼唤 市场 基金 评论员 王雅玲 发行 跌破 发行价 利率 走高 辽宁 利率 高达 1.78 发行 中标 利率 新高 认购 倍数 1.5 三个 投标 两个...
658,1,财经 债券 市场 经济 存在 好转 机会 江沂 深圳 熊市 债券 避风港 投资者 收益 市场 形势 巨大变化 流动性 充足 连续 低利率 挑战 基金 经理 管理...
659,0,科技 专业级 单反相机 佳能 D 降至 佳能 EOS D 经典 黑色 机身 主色调 整体 大气 专业 D 机身 尺寸 D 机身 厚度 D 减少 3.1 左右 高...
660,0,科技 mm 超广角 理光 GX200 售价 作者 袁源 满足 摄影 爱好者 摄影 需求 GX200 提供 1.88 X 镜头 mm 广角 转换 镜头 DW 官方...
661,5,娱乐 娱乐 独家 奉献 纽曼 精彩 纽曼 荧幕 动人 角色 打动 妻子 生死 不离 实在 好莱坞 奇迹 商业 成就 证明 演员 具有 超人 商业 天赋 值得 回...
662,1,财经 基金 转口 青睐 地产 有色 江沂 很多 预计 投资 加大 年份 三个 基金 管理 很多 意外 基金 投研 团队 重要 控制 仓位 侧重于 准确 把握 轮...
663,3,体育 休城 专家 控卫 抽签 命运 难测 火箭 状元 概率 0.5 北京 火箭队 总经理 莫雷 打算 洛瑞 出席 抽签 决定 火箭队 透秀 顺位 记事 专栏 杰...
664,4,游戏 手机 网游 神契 OL 玩家 评测 神契 online 内测 备受 玩家 热爱 支持 段时间 探索 旅程 玩家 撰写 神契 online 玩家 评测 游戏...
665,3,体育 湖人 vs 黄蜂 前瞻 VI 是否 摆脱 伤病 尊严 北京 黄蜂队 卫冕冠军 洛杉矶 湖人队 制造 足够 回到 主场 面临 生死战 争取 继续 神勇 率队...
666,5,娱乐 暮光 男主角 拍戏 受伤 经纪人 否认 娱乐 北京 媒体报道 暮光 Twilight 男主角 罗伯特 帕丁森 Robert Pattinson 加拿大 拍...
667,1,财经 收评 指跌 0.92 八成 封基 下挫 财经 基指 低开 全天 地位 震荡 收盘 小幅 收跌 八成 封基 下挫 基指 开盘 报于 335.27 低开 33...
668,3,体育 球员 教练 沟通 原谅 处罚 本报讯 田欣欣 了解 球员 找到 利民 沟通 利民 年轻 队员 机会 个别 队员 处罚 小孩 想法 质问 标准 要求 优秀 ...
669,5,娱乐 韩碟 手册 悲梦 抽离感 境界 娱乐 金基德 照例 一部 片子 速度 一部 悲梦 金导 抽离 高级别 不顾 观众 观赏 水准 个人艺术 追求 道路 一路 ...
670,4,游戏 灵兽 世界 入门 攻略 灵兽 世界 游戏 跟着 任务 新手村 容易 了解 灵兽 灵兽 合成 技能 能够 选宠 基础 个人 总结 几点 内容 大家 一起 分...
671,0,科技 时尚 超薄 家用 卡片 DC 尼康 S630 套装 尼康 S630 机身 尺寸 96.5 57.5 25.5 mm 重量 g 颜色 多种多样 黑色 宝石 ...
672,1,财经 华夏 现金 增利 基金 上调 申购 业务 限额 全景网 日讯 华夏 基金 公告 旗下 华夏 现金 增利 基金 申购 业务 限额 万元 调整 万元 投资人 ...
673,2,体育 ESPN 老鱼 北京 季后赛 首轮 湖人 黄蜂 比赛 看出 卫冕冠军 有点 出来 舆论 球迷 信任 ESPN 专栏作家 戴夫 信任 撰稿 外界 要求 做到...
674,1,财经 指数 基金 结束 募集 本报讯 据悉 指数 基金 LOF 结束 募集 基金 优秀 投资 标的 独特 LOF 运作 模式 方便 投资者 认可 认购 投资者 ...
675,5,娱乐 阿汤哥 重回 一线 明星 新片 选择 多多 娱乐 北京 北美 美国 媒体 综艺 出演 二战 行动 目标 希特勒 Valkyrie 汤姆 克鲁斯 Tom C...
676,2,体育 个人 犯规 不会 失望 北京 季后赛 第二轮 第四场 湖人 客场 挑战 小牛 湖人 不敌 小牛 遭遇 横扫 糟糕 安德鲁 拉玛尔 双双 恶意 犯规 出场 ...
677,1,财经 基金 公司 力源 液压 定向 增发 证券时报 朱景锋 本报讯 市场 回暖 基金 投资 发行 热情 力源 液压 公布 发行 参与 增发 九家 机构 五家 基...
678,1,财经 基金 减仓 迹象 新快报 吴谭 研究 机构 监测 结果显示 开放式 基金 股票 仓位 结束 连续 上升 减仓 迹象 整体 仓位 变化 幅度 判断 基金 投...
679,4,游戏 魅力 无限 封神 ol 新服 活动 大家 停不住 一位 喜欢 无聊 勤快 玩游戏 手机 网游 封神 ol 忙碌 生活 选择 挂机 升级 玩游戏 上线 享受...
680,5,娱乐 希斯 奖金 问世 澳洲 娱乐 北京 美国 一项 澳洲 明星 希斯 Heath Ledger 命名 奖金 美国 洛杉矶 面世 用于 鼓励 有志 美国 发展 ...
681,3,体育 公牛 vs 老鹰 赛程 出炉 东区 黑马 继续 北京 老鹰 主场 险胜 魔术 总比分 晋级 半决赛 对阵 公牛 NBA 官方 公布 一组 比赛 赛程 安排...
682,4,游戏 世博 时装秀 眼球 一杯 咖啡 牵手 看着 落叶 飘落 静静 享受 花开 欣赏 灿烂 微笑 乐园 愿意 一生 快乐 见证 宛如 情人 世博 漫步 季节 旋...
683,0,科技 电视 M39 M39 数码 两个 颜色 形象 包装 多种 音频 视频 播放 格式 现价 朋友 关注 一下 性能 M39 支持 播放 RM RMVB DAT...
684,3,体育 体育 视频 直播 热火 vs IV 破咒 北京 体育 视频 直播 季后赛 主场 迎战 热火 比赛 双方 总比分 热火 领先 热火 四年 波士顿 过球 上赛...
685,0,科技 高性能 宾得 Kx 白色 限量版 热卖 宾得 K x 像素 成像 能力 自动 对焦 系统 一秒 4.7 张连 s 配备 p 高清 摄像 性能 经销商 搭配...
686,0,科技 mm 广角 防抖 镜头 D LUX4 售价 作者 陈亮 D LUX 松下 LX3 数码相机 接近 外观 上看 D LUX 相比 D LUX 改变 很大 尺...
