文档ID,簇编号,原文片段（分词行）
687,5,娱乐 黑皮 过审 上映 本能 导演 力作 娱乐 中影集团 引进 发行 好莱坞 导演 范霍文 作品 黑皮 电影局 内容 审查 登陆 院线 强势 抢占 贺岁 观影 ...
688,5,娱乐 金荷娜 新片 造型 海报 抄袭 史密斯 夫妇 娱乐 北京 香港媒体 韩星 姜志焕 金荷娜 合作 新片 公务员 宣传 海报 造型 海报 抄袭 史密斯 夫妇 ...
689,1,财经 基金 享受 红色 平均 收益 23.46 证券时报 本报讯 业绩 已见分晓 型基金 一把 净值 市场 上扬 回升 银河 数据 统计 显示 纳入 统计 口径...
690,4,游戏 九州 online 惊爆 第一 诅咒 宝箱 九州 online 资料片 风云 再起 大家 强势 打造 大漠 飞鹰 超强 副本 副本 玩家 机会 赢取 BO...
691,2,体育 大胜 晋级 悲情 告别 北京 卫冕冠军 湖人 客场 击败 黄蜂 总比分 晋级 半决赛 对手 开拓者 小牛 胜者 评价 湖人 淘汰 黄蜂 晋级 第二轮 湖人...
692,5,娱乐 贫民 富翁 瓜分 金球 奥斯卡 斯莱特 好莱坞 外国 协会 金球奖 上温 斯莱特 意外 拿下 女主角 女配角 桂冠 金球奖 耀眼 明星 金球 全胜 举行 ...
693,3,体育 罗斯 客场 大胜 老鹰 公牛 晋级 热火 北京 公牛 客场 击败 老鹰 晋级 决赛 大战 巨头 领衔 热火 公牛 首度 决赛 飞人 乔丹 夺冠 罗斯 拿下...
694,4,游戏 神契 OL 公测 诸神 开启 北京 创娱 年度 倾情 巨献 首款 Q版 魔幻 史诗 巨作 手机 网游 神契 online 开启 公测 神契 大门 开启 充...
695,1,财经 成立 基金 合计 亿元 本报讯 多只 基金 结束 募集 基金 迎来 成立 高潮 天相 投资 统计 基金 结束 募集 宣告成立 合计 规模 亿元 平均 基金...
696,0,科技 光学 变焦镜头 三星 PL70 单机 降至 三星 PL70 外观 延续 简洁 干练 设计 风格 机身 圆润 小巧 起来 方便 三围 95.8 59.5 2...
697,3,体育 vs 雷霆 III 前瞻 兰胖 豪言 主场 生命线 雷霆 主场 战罢 双方 系列赛 打平 回到 主场 孟菲斯 力保 主场 相当于 胜利 一点 季后赛 首轮...
698,0,科技 中端 强机 尼康 D90 套机 促销 售价 尼康 D90 单方 市场 机型 尼康 便宜 具有 自动 马达 超旺 人气 尼康 D90 套机 VR 尼康 包加...
699,5,娱乐 量子 危机 上映 拳头 不秀 爱情 裴军 实习生 曾盼婧 架着 车门 最新款 阿斯顿 马丁 跑车 电影 量子 危机 零点 登陆 深圳 丹尼尔 饰演 子弹 ...
700,5,娱乐 周星驰 好莱坞 意见 评论 龙珠 新报 轶凡 周星驰 监制 周润发 主演 好莱坞 影片 龙珠 进化 亚洲 宣传 活动 影迷 期待 双周 实现 周星驰 缺席...
701,0,科技 光学 变焦镜头 尼康 S230 尼康 S230 轻薄 机身 设计 促销 产品 产品 机壳 配色 时尚 S230 取景 一块 3.0 英寸 像素 触控 显示...
702,0,科技 有效 像素 三星 ST10 套装 作者 李金昊 三星 ST10 一块 英寸 像素 液晶 显示屏 设计 镜头 光学 变焦 潜望 镜头 SD 存储卡 存储介质...
703,5,娱乐 金熊 拜倒 石榴裙 梅兰芳 完败 信息 时报讯 北京 柏林 电影节 落下 帷幕 秘鲁 西班牙 合拍 影片 伤心 奶水 击败 众多 大师 名导 勇夺 金熊奖...
704,1,财经 疲劳 基金 经理 孙延群 摩根 投资 总监 事件 摩根 基金 管理 有限公司 公告 投资 总监 孙延群 先生 健康 原因 治疗 休养 基金 经理 第一例 ...
705,1,财经 基金 第三方 支付 浮出 水面 汇付 静候 审批 见习 静默 基金 第三方 支付 有望 开闸 消息人士 透露 汇付 华夏 基金 民生银行 携手 试点 格局...
706,5,娱乐 林志玲 佛利 武士 好莱坞 男星 搭档 娱乐 电影 佛利 武士 开拍 续集 发行 新力 电影 公司 透露 林志玲 饰演 一角 影片 韩国 济州岛 取景 男...
707,3,体育 加索尔 霍华德 冠军 重新 正名 北京 季后赛 出局 几天 加索尔 接受 告别 采访 显得 沮丧 球队 出局 解脱 出来 季后赛 失利 加索尔 前进 动力...
708,3,体育 斯特恩 考虑 修改 NBA 干扰 规则 采纳 国际 篮联 建议 北京 美联社 NBA 总裁 大卫 斯特恩 接受 采访 考虑 修改 干扰 规则 国际 篮联 ...
709,4,游戏 明珠 幻想 免费 打造 史诗 装备 魔幻 旅程 战场 想要 胜利者 面对 敌怪 消灭 有利 手段 极品 装备 高品质 装备 大家 百战百胜 幻想 隆重推出...
710,5,娱乐 歌手 歌舞片 出演 妓女 娱乐 音乐 电影 Nine 饰演 一名 妓女 一部 芝加哥 导演 劳勃 马歇尔 Rob Marshall 执导 歌舞片 太棒了 ...
711,1,财经 业绩 相差 超过 基金 经理 业绩 分化 刘建强 一位 基金 经理 管理 不同 基金 业绩 相差 类型 基金 业绩 资料 基金 经理 管理 基金 业绩 分...
712,3,体育 Z 脚踝 扭伤 缺席 全队 对抗 训练 斯帅 无需 调整 北京 热火 全队 休整 一天 球馆 恢复 备战 训练 传出 伤病 主力 中锋 Z 一场 比赛 扭...
713,1,财经 基金 仓位 逼近 牛市 水平 长城 证券 阎红 宋邵峰 A股 市场 反弹 基金 整体 股票 仓位 上升 长城 证券 测算 型基金 剔除 基金 加权 平均 ...
714,0,科技 画幅 单反相机 尼康 D700 套机 售价 尼康 D700 机身 D300 蓝本 少许 改动 镁合金 材质 外壳 底盘 反光镜 降低 机身 重量 具有 优...
715,5,娱乐 奥斯卡 提名 刺激 票房 贫民 富翁 暴富 美国 一月 二十二日 第八 十一届 奥斯卡 电影 金像奖 提名 名单 贝弗利 公布 贫民 富翁 对话 尼克松 ...
716,4,游戏 乐园 韩风 春装 震撼 上市 向前走 换上 乐园 新装 挥洒 青春活力 一起 带上 手机 换上 衣裳 一起 寻觅 味道 灵气 乐园 时尚 风格 主题 个人...
717,4,游戏 手机 网游 神域 OL 神秘 洞穴 副本 解析 大家 全国 爱耳日 拿掉 耳朵 耳机 耳朵 放松 一下 健康 关注 无聊 打发 玩玩 神域 具有 浓厚 中...
718,0,科技 光学 变焦 镜头 卡西欧 Z2 卡西欧 Z2 2.3 英寸 CCD 感光 元件 光学 变焦 镜头 最大 F3 .1 5.6 等效 焦距 mm 卡西欧 Z2...
719,1,财经 融通 涉嫌 老鼠 散户 本报讯 赵侠 摩根 基金 经理 唐建 老鼠 处罚 一年 融通 基金 爆出 老鼠 嫌疑 来自 Wind 资讯 统计数据 显示 一位 ...
720,1,财经 银华 和谐 主题 基金 发行 本报讯 获悉 银华 基金 公司 旗下 基金 产品 银华 和谐 主题 灵活 配置 基金 发行 投资者 建行 交行 招行 银行 ...
721,0,科技 有效 像素 索尼 W290 作者 Cetan 索尼 W290 找到 3.0 英寸 像素 视角 液晶屏幕 LCD 增大 索尼 W290 取消 了前 W170...
722,0,科技 光学 变焦镜头 理光 R8 理光 R8 R 设计 复古 风格 机身 金属 面板 塑料 部分 磨砂 处理 三围 尺寸 102.2 26.1 58.3 mm ...
723,1,财经 申万 巴黎 竞争 优势 基金 首次 分红 本报讯 敖晓波 申万 巴黎 基金 宣布 公司 旗下 巴黎 竞争 优势 基金 实施 第一次 分红 基金 份额 金红...
724,5,娱乐 怪人 二十面 相传 金城武 日本 李丽 多年 浸淫 华语 市场 混血儿 金城武 重新 想起 日本 观众 拍摄 文艺片 死神 精确度 遭遇 票房 惨败 有幸...
725,1,财经 基金 普丰 年度 收益分配 份派 0.054 全景网 日讯 鹏华 基金 公告 旗下 基金 年度 收益分配 基金 份额 派现 0.054 共计 金红利 万元...
726,0,科技 支持 光学 变焦 富士 Z33WP 富士 Z33WP 2.3 英寸 有效 像素 CCD 一枚 光学 变焦镜头 等效 焦距 mm 最高 ISO 感光度 双重...
727,0,科技 光学 变焦镜头 富士 J26 富士 J26 外观设计 时尚 mm 超薄 机身 外壳 颜色 喜好 J26 机身 外壳 独特 双层 涂漆 工艺 漂亮 富有 光...
728,5,娱乐 后继有人 剽窃 宣判 华纳公司 娱乐 美国联邦 法院 宣判 华纳 兄弟 公司 影片 后继有人 We Are Marshall 剽窃 艾美奖 获奖 运动 纪...
729,2,体育 最悲 卫冕冠军 湖人 热火 敌后 乔丹 沦陷 北京 湖人 小牛 横扫 郁闷 事情 郁闷 篮圈 世界 看来 湖人 起码 入选 郁闷 卫冕冠军 只够 排上 湖...
730,3,体育 专家 德克 关键球 科蜜 几个 北京 第一场 绝杀 连续 第五次 季后赛 扳平 绝杀 对手 自嘲 关键 先生 ESPN 麦克马洪 火上浇油 撰文 指出 数...
731,1,财经 基金 建仓 首选 蓝筹股 万科 A 受宠 别冶 发自 北京 时钟 表针 艰难 降生 基金 有利 建仓 时机 重仓股 选择 基金 体现 市场 热点 行情 走...
732,1,财经 私募 高呼 投资 A股 超过 深圳 五洲 宾馆 参加 第三届 私募 基金 高峰论坛 五位 顶尖 阳光 私募 掌门人 亮相 私募 论坛 指点 投资 机会 掀...
733,4,游戏 d 赤壁 国战 装备 巡展 d 赤壁 OL 紧张 刺激 诸侯 攻城战 开启 小队 结义 军团 诸侯 激烈 战场 夺得 城市 美人归 雄心 不够 多一点点 ...
734,0,科技 P HDMI 输出 思歌 S40 作者 毛晓曼 思歌 旗下 首款 全高清 PMP 播放器 S40 曝光 产品 支持 P 全高清 解码 播放 支持 HDMI...
735,4,游戏 口袋 精灵 无数 朋友 关注 掌上 宠物 乐园 度过 一周岁 绚丽 口袋 精灵 口袋 精灵 玩家 热情 围绕 欢快 愉悦 宠物 乐园 世界 口袋 元宝 赠...
736,3,体育 热火 传奇 聚首 督战 训练 信心 北京 热火 球馆 训练场 备战 季后赛 第二轮 首次 训练 吸引 了近 百位 采访 希望 赢下 现场 热火 传奇 找到...
737,4,游戏 小奥 农场 第三产业 选择 西南地区 干旱 范围 不断扩大 云南 扩展 四川 贵州 广西 受灾 人数 超过 少见 世纪 大旱 农作物 万公顷 万公顷 良田...
738,5,娱乐 明星 确认 出席 金球奖 埃夫隆 海顿 年轻 娱乐 北京 来自 第六十六 金球奖 一批 明星 确认 出席 晚八点 直播 颁奖典礼 播美 英雄 Heroes...
739,4,游戏 开发者 AppStore 白痴 游戏 下架 Tommy Refenes 游戏 开发者 会议 苹果 App Store 比作 白痴 糟糕 老虎 掌机 惊讶 ...
740,4,游戏 赤壁 OL 结婚 怀孕 能生 宝宝 宝宝 手机 网游 怀疑 out d 赤壁 OL 实现 宝宝 功能 婚姻 恋爱 结婚 怀孕 宝宝 流程 不会 双胞胎 爸...
741,4,游戏 手机 网游 口袋 精灵 一大 回馈 金翎 手机 网络游戏 第一名 口袋 精灵 充值 金币 道具 免费 游戏 W 银币 奖励 浪漫 婚姻 系统 超强 宠物 ...
742,1,财经 基金 投资 总监 掌舵 品种 业绩 抢眼 安仲文 市场 回暖 行情 型基金 业绩 大多 反弹 不同 基金 分化 十分 明显 优秀 基金 反弹 幅度 超过 ...
743,4,游戏 女儿国 OL 现实 爱情 悲剧 女儿 国联 想到 西游记 想起 很多 杯具 看完 猪八戒 想起 开头 铁扇公主 牛魔王 现实 上演 出轨 铁扇公主 牛魔王...
744,2,体育 调查 湖人 王朝 是否 延续 交易 筹码 北京 湖人 小牛 三分 袭击 惨败 惨败 季后赛 第二轮 横扫 相关 调查 体育...
745,5,娱乐 Rain 好莱坞 电影 片酬 可怜 娱乐 媒体报道 韩国 Rain 一部 好莱坞 电影 异乡 吃苦 受罪 生病 片酬 区区 几万元 折合 人民币 成功 进...
746,0,科技 单反相机 佳能 D 套机 搭载 配件 中关村 数码影像 行情 佳能 EOS D 像素 成像 能力 张连 性能 具备 高清 摄像 功能 单反相机 登陆 市场...
747,0,科技 G B超 大容量 昂达 VX575HD 作者 曹锐 昂达 VX757HD 延续 一贯 神秘 黑色 外形 设计 四角 弧线 处理 视觉 更具 时尚 流行 M...
748,1,财经 基金 季报 增减 基金业 拉开 基金 季报 披露 大幕 基金 公司 旗下 基金 公布 报告 统计数据 显示 基金 大量 增持 周期性 行业 减持 非周期性...
749,1,财经 0.6 代销 费率 直逼 基金 直销 底线 理财 周报 实习 王韵亭 敬请 基金 投资人 阅读 销售 渠道 基金 申购 费率 亦可 可观 费用 市场 回暖...
750,0,科技 时尚 小巧 卡片 降至 收到 广州 太平洋 商家 u1070 促销 价格 下调 性价 提升 购买 时尚 卡片 朋友 值得 关注 点评 u1070 配置 滑...
751,1,财经 基金 期待 证券时报 余子君 本报讯 基金 公司 年报 全部 披露 完毕 业绩 投资者 带来 高回报 明星 基金 年报 备受 关注 年报 后市 看法 操作...
752,4,游戏 棒棒 棒女 露面 小棒 hi 大家 小棒 小棒 友友 大家 了解 一起 游戏 一起 社区 小棒 小棒 小棒 游戏 社区 大家 希望 带给 大家 快乐 最大...
753,1,财经 三只 基金 四月 集体 分红 证券时报 杜志鑫 本报讯 博时基金 管理 公司 发布公告 旗下 主题 行业 股票 LOF 精选 股票 基金 裕阳 三只 基金...
754,4,游戏 游记 网游 走出 传统 网游 桎梏 大多数 传统 游戏 玩家 现行 网络游戏 内容 包罗万象 开发 游戏 类型 挖掘 殆尽 游戏 发展 只能 比拼 精美 ...
755,4,游戏 灵兽 世界 恶魔 灵兽 狂欢节 活动 玩家 龙系 恶魔 灵兽 期盼 恶魔 灵兽 揭开 神秘 面纱 帅气 独特 属性 恶魔 灵兽 抓紧 参加 充值 恶魔 宠...
756,4,游戏 网游 明珠 三国 国家 押运 奖励 明珠 三国 手机 网游 巅峰 巨作 精美 游戏 画面 人性化 系统 设置 背景 故事 坐骑 婚姻 官衔 战场 交易 副...
757,4,游戏 手机 网游 天问 群雄 争霸 输赢 有奖 天问 OL 群雄 争霸赛 举行 聚集 众多 人气 争夺 比赛 帮派 最高 奖项 公会 派出 最强 阵容 尽显 公...
758,3,体育 霍林斯 直言 感谢上帝 抓到 胜机 两双 带领 填上 大坑 守住 主场 系列赛 领先 主场 看来 魔力 主场 战绩 公牛 主场 战绩 主帅 霍林斯 逆转 ...
759,0,科技 光学 变焦镜头 富士 Z33WP 防水 富士 Z33WP 外形 设计 时尚 外壳 磨砂 处理 边角 圆润 设计 造型 可爱 五款 靓丽 颜色 尺寸 59....
760,4,游戏 三国 印魂 帮派 系统 争霸 帮派 永恒不变 主题 游戏 帮派 存在 乱世 英雄 演义 乱世 争霸 三国 印魂 玩家 提供 争霸 机会 让玩家 实现 游戏...
761,0,科技 画幅 单反相机 佳能 DMarkII 带票 作者 芦晓峰 佳能 EOS D Mark II 外观设计 延续 佳能 特点 黑色 外观 尽显 专业 高强度 铝...
762,1,财经 国海 富兰克林 万元 自购 旗下 本报讯 国海 富兰克林 基金 管理 有限公司 公告 运用 公司 自有 资金 投资 旗下 富兰克林 国海 强化 收益 债券...
763,3,体育 菩萨低眉 石佛 单节 马刺 找回 NBA 季后赛 首轮 继续 西区 焦点 战役 圣安东尼奥 马刺 主场 加时赛 击败 孟菲斯 总比分 扳成 马刺 核心 邓...
764,0,科技 mm 超广角 变焦镜头 松下 LX3 作者 宋心杰 LX3GK 镜头 变焦 2.5 mm 广角镜头 LX 首次 比起 产品 镜头 广角端 开阔 3.0 英...
765,1,财经 封闭 基金 折扣率 部分 基金 年度 分红 刺激 封闭式 基金 板块 一个月 抢眼 整体 折价率 小幅 下降 统计数据 显示 截至 四只 封基 实施 公布...
766,4,游戏 天问 online 回忆 感动 闪过 树影 耳机 手机 熟悉 音乐 离开 家乡 去向 工作 城市 回想 春节假期 回忆 事情 工作 两年 回家 第一次 车...
767,0,科技 视频 直播 功能 iriverP7 作者 毛晓曼 iriver P7 延续 产品 简单 时尚 外形 设计 个性化 操作 UI 加入 RMVB 视频 直播 ...
768,5,娱乐 奥斯卡 主持人 首张 宣传照 发布 娱乐 北京 北美 两周 举行 奥斯卡 颁奖典礼 发布 主持人 Hugh Jackman 宣传照 参加 奥斯卡 颁奖 嘉...
769,1,财经 私募 基金 亏损 三成 财经网 深圳 专稿 符燕艳 私募 基金 整体 收益 为负 32.86 投资 企业 业绩 下滑 比例 六只 私募 基金 实现 收益 ...
770,4,游戏 手机 网游 时空 OL 双倍 经验 免费 洗点 时空 删档 内测 大量 钟情 爽快 PK 协同作战 玩家 过瘾 活动 开展 游戏 新手 冲级 最高 冲级 ...
771,1,财经 成立 三个 多月 金鹰 红利 分红 王慧娟 月份 成立 金鹰 红利 价值 基金 分出 成立 第一桶金 基金 截至 分配 收益 基准 基金 份额 派发 红利...
772,0,科技 打造 超薄 机身 纽曼 Super Card 作者 毛晓曼 升级版 纽曼 Super Card 增加 RMVB 视频 直播 功能 保持 6.5 mm 超薄...
773,1,财经 基金 通乾 分红 分红 封闭式 基金 陷入 困局 前提 融通 旗下 封闭式 基金 通乾 分红 分红 转变 显示 基金 公司 暧昧 分红 规则 混沌 冯庆汇...
774,4,游戏 d 网游 赤壁 新区 手机 mp4 充值卡 传统节日 愚人节 信息 d 赤壁 OL 大家 打来 惊喜 一点 不会 愚人节 愚人 带来 开心 d 赤壁 OL...
775,0,科技 高清 播放器 爱国者 MP5909HD 作者 毛晓曼 爱国者 MP5909HD 4.3 英寸 屏幕 支持 高清 播放 产品 售价 GB 容量 兴趣 朋友 ...
776,1,财经 基金 交易 佣金 基金 支付 券商 交易 佣金 格局 年度 很大 变化 挤入 中金公司 券商 佣金 分仓 第一名 多年 申银万国 证券 行业 翘楚 中信证...
777,1,财经 基金 公司 资产 质量 现形 规模 接近 管理费 一倍 巩万龙 发自 深圳 得益于 基金 发行 固定 收益 产品 基金 公司 熊市 管理费 实现 增长 有...
778,3,体育 大牌 自由 球星 姚明 减薪 北京 姚明 巴蒂尔 海耶斯 火箭队 火箭队 球员 共同点 今年夏天 自由 球员 篮圈 世界 专栏作家 汤姆 自由 球员 市场...
779,0,科技 锁住 爱情 爱国者 PM5927 作者 曹锐 爱国者 PM5927 四种 外观 颜色 机身 别致 月牙 镶嵌 设计 配备 独特 月牙 爱情 密钥 密钥 嵌...
780,5,娱乐 电影版 铁臂 阿童木 确定 北美 公映 附图 娱乐 备受 期待 CG 动画电影 铁臂 阿童木 Astro Boy 北美 公映 确定 美国 负责 发行 制作...
781,5,娱乐 广末凉子 加盟 悬疑 推理 新片 焦点 娱乐 北京 日本 媒体报道 离婚 广末凉子 事业 回到 高峰 受邀 主演 日本 知名 推理 小说家 松本 清张 代...
782,4,游戏 侠义 OL 新服 起航 是否 想要 疲倦 停靠 港湾 一群 来自 天南地北 朋友 扶持 共谋 生存 帮派 最好 选择 江湖 相交 厮杀 风云 笑傲江湖 惬...
783,3,体育 皇帝 领衔 入选 现役 纪录 北京 NBA 官方 公布 常规赛 三队 名单 詹姆斯 凯文 杜兰特 德怀特 霍华德 罗斯 领衔 一队 皇帝 第一 选票 成绩...
784,1,财经 基金 开户数 回落 四成 中登 公司 公布 数据 显示 基金 开户数 3.2432 万户 回落 超过 四成 基金 单周 开户数 最低 一周 市场 暖风 基...
785,5,娱乐 柏林 电影节 官网 电影节 开幕 华丽 娱乐 北京 柏林 电影节 官网 众星 云集 动作 跨国 银行 The International 全球 首映 宣告...
786,2,体育 首场 湖人 胜出 概率 四成 洛城 小牛 先机 小牛 客场 拿下 系列赛 第一场 胜利 系列赛 胜利 好头 七场 四胜 七番 大战 击败 湖人 击败 禅师...
787,1,财经 基金 产品 交易所 革命 方便 申购 降低 费率 套利 机会 袁京力 酝酿 交易 结算 体系 证券 交易所 基金 账户 基金 持有人 费用 效率 申购 赎...
788,0,科技 热门 专业级 小巧 DC 佳能 S90 套装 作者 张跃 佳能 PowerShot S90 具有 能够 放入 衬衫 口袋 小巧 机身 搭载 旗舰 机型 P...
789,3,体育 绿军 出局 久盼 喜讯 继续 绿军 一场 比赛 足够 改变 决定 激情 充溢 止不住 大幕 落下 投以 留恋 目光 波士顿 客场 负于 热火 总比分 淘汰...
790,0,科技 时尚 家用 卡片 DC 佳能 IXUS120 带票 作者 芦晓峰 IXUS IS 不锈钢 机身 设计 时尚 冷艳 深邃 宁静 华丽 四种 充满 都市 情绪...
791,0,科技 光学 变焦 潜望 镜头 尼康 S70 外观 上看 尼康 S70 三围 尺寸 96.5 60.5 mm 造型 纤薄 触摸 显示屏 寒冷 按键 操作 方便 画...
792,5,娱乐 印度 片片 发音 接近 哈利 波特 起诉 娱乐 制作 电影 片名 哈利 波特 同音 印度 电影 公司 华纳 兄弟 公司 起诉 事情 起因 印度 孟买 一家...
793,0,科技 高端 单反相机 佳能 D 带票 套机 售价 作者 陈亮 EOS D 实现 了在 有效 像素 高画质 高达 连拍 速度 搭载 智能 自动 对焦 系统 众多 ...
794,0,科技 光变 镜头 佳能 IXUS200IS 点评 卡片机 2.3 英寸 像素 CCD 支持 p FPS 高清 摄像 支持 IS 防抖 IXUS 搭载 mm 五倍...
795,4,游戏 诸神 新服 光石 开启 春回燕 诛神 online 受到 众多 玩家 喜爱 支持 火爆 手游 能够 玩家 加入 诛神 online 玄幻 世界 开启 服务...
796,5,娱乐 爱子 右翼 分子 恐吓 酒井法子 辞演 梦墙 连续 合拍 电影 梦墙 引起 很多 读者 关注 波折 全部 准备 工作 就绪 不料 遇到 难题 日本 右翼 ...
797,4,游戏 禁地 完整 评测 游戏 名称 禁地 游戏 语言 中文 游戏 提供商 上海 网络通讯 科技 有限公司 游戏 类型 角色扮演 游戏 KB 游戏 版本 1.0....
798,5,娱乐 外滩 画报 入殓 死亡 亲密 交流 木雅弘 红地毯 解释 飞机 晚点 希望 看上去 疲惫 职业 闪光灯 微笑 直觉 蛮好 专访 个人 两个 量级 不能 木...
799,4,游戏 手游 用户 付费 意愿 成受 关注 行业 G 移动 互联网 兴起 手机游戏 行业 风生水 易观 国际 发布 报告 显示 中国 移动 互联网 市场 规模 亿...
800,0,科技 像素 VGA 液晶屏 理光 GRDIII 作者 陈亮 镜头 下功夫 理光 GRDIII 传感器 前作 GRDII 类似 1.7 英寸 像素 级别 CCD ...
801,2,体育 湖人 传言 内线 妻子 恨卡戴 湖人 总比分 小牛 横扫 出局 湖人 传言 加索尔 不和 队友 缺乏 信任 不满 队友 状态 球队 面临 重建 湖人 负面...
802,1,财经 信达 澳银 稳定 价值 成立 11.4 全景网 日讯 信达 澳银 基金 公告 旗下 信达 澳银 稳定 价值 债券 型基金 成立 募集 总额 11.4 亿元...
803,1,财经 分析师 基金 股市 资金面 支持 有限 李娜 发自 上海 广大 基民 演绎 时代 市场 基金 流行 基金 规模 回暖 基金 股市 造血 功能 回归 市场 ...
804,0,科技 余音绕梁 天籁 纽曼 纯音乐 B30 热卖 音质 小屏 纯音乐 MP3 备受 追捧 纽曼 纯音乐 MP3 B30 上市 伊始 广受 好评 天籁 音质 余音...
805,3,体育 洛瑞休 闲不住 莫雷派 钢炮 出席 乐透 顺位 抽签 北京 NBA 选秀 乐透 顺位 抽签 NBA 季后赛 焦点 注定 选秀 状元 归属 不会 选秀 吸引...
806,0,科技 炫彩 时尚 纯音乐 MP3 昂达 VX333 VX515 VX313 VX323 型号 纯音乐 MP3 带来 纯音乐 机型 昂达 VX333 低调 风格 ...
807,5,娱乐 李安 新片 伍德斯 美媒体 看好 娱乐 北京 台湾 媒体报道 影展 大赢家 李安 影后 伊美妲 史坦顿 阔别 合作 制造 伍德斯 音乐节 Taking W...
808,0,科技 高清 摄像 光变 索尼 H20 搭配 中关村 数码相机 行情 索尼 H20 千万 像素 成像 能力 配备 一枚 十倍 光学 变焦镜头 具备 光学 防抖 功...
809,0,科技 光学 变焦镜头 佳能 IXUS120 佳能 IXUS IS 延续 了前 IXUS IS 时尚 超薄 外观设计 镜头 升级 机身 厚度 IXUS IS 1....
810,3,体育 控股 黄蜂 球市 季票 销量 北京 所有权 转让 球队 迁址 劳资 协议 不确定性 围绕 黄蜂队 抵挡 城市 球迷 球队 支持率 提高 美联社 黄蜂 统计...
811,5,娱乐 圣丹斯 渐入 高潮 明星 主演 电影 首映 娱乐 美国 圣丹斯 国际 电影节 第五天 开展 备受 关注 热门 电影 亮相 中国 导演 张元 blog 凯瑞...
812,0,科技 潮流 时尚 家用 DC 佳能 IXUS100IS 佳能 伊克 萨斯 性能 外观 并重 一点 佳能 IXUS IS 超薄 机身 厚度 18.4 mm 外形尺...
813,1,财经 基金 经理 叫板 经济学家 宏观 数据 换手率 成交额 重要 增长 指标 GDP 6.1 6.3 投资 28.8 26.5 消费 15.0 14.5 理财...
814,5,娱乐 专访 梦工厂 CEO 卡赞 伯格 中国 市场 娱乐 梦工厂 CEO 卡赞 伯格 怪兽 大战 外星人 配音演员 观众 熟识 小时 男主角 基弗 萨瑟兰 一起...
815,4,游戏 伏龙 奇侠传 传奇 特点 揭秘 伏龙 奇侠传 传奇 精品 动作 角色扮演 游戏 寻常 角色扮演 手游 不同 独特 游戏 风格 糅合 战斗 侦探 解谜 精彩...
816,5,娱乐 忍者神龟 真人 结合 电脑 动画 制作 娱乐 忍者神龟 Teenage Mutant Ninja Turtles 凯文 Kevin Eastman 和皮特...
817,0,科技 轻薄 入门 卡片 富士 J26 山东 IT 富士 J26 商家 济南 北星 数码 售价 G 存储卡 富士 J26 继承 富士 J 家用 低价 优势 千万 ...
818,3,体育 调查 公牛 淘汰 老鹰 决赛 热火 相遇 北京 公牛 客场 击败 老鹰 晋级 决赛 大战 巨头 领衔 热火 公牛 淘汰 老鹰 决赛 热火 相遇...
819,3,体育 雷霆 板凳 上藏 节拍器 控卫 效率 惊人 热火 詹姆斯 打败 激动 落泪 遥远 俄克拉荷马 詹姆斯 詹姆斯 雷霆 队里 重要 第六 大胡子 球员 看上去...
820,3,体育 皇帝 关键 疑似 走步 上篮 绝杀 一幕 重现 视频 北京 热火 客场 力克 系列赛 取得 领先 比赛 争议 最大 一幕 第四节 时刻 詹姆斯 疑似 走步...
821,4,游戏 明珠 幻想 世界大战 阵营 系统 上线 明珠 幻想 资料片 世界大战 全面 开启 玩家 展现 魔幻 手机 网游 独特 魅力 资料片 展现 庞大 阵营 系统...
822,5,娱乐 吕克 贝松 携手 韩方 投资 秦始皇 计划 娱乐 法国 导演 吕克 贝松 两家 法国 公司 一起 参与 秦始皇 计划 剧本 改编 工作 历史 悬疑 影片 ...
823,0,科技 闪存 DV 促销 佳能 FS200 带票 购买 佳能 FS200 数码 摄像机 参加 换购 活动 专业 镜头 佳能 原厂 锂电池 BP 品胜 充电 套装 ...
